{
  "apiVersion": "tracemind.io/v0.1",
  "kind": "Proposal",
  "metadata": {
    "id": "prop-c3-regression",
    "version": "1.0.0"
  },
  "spec": {
    "impacted_intents": ["TM-INT-1001"],
    "patch_refs": ["patch_ok.json"],
    "testsuite_refs": ["testsuite_hard_pass.json"],
    "risk": "low",
    "summary": "trigger c3"
  }
}
