{
  "apiVersion": "tracemind.io/v0.1",
  "kind": "Patch",
  "metadata": {
    "id": "patch-tighten-guard",
    "version": "1.0.0"
  },
  "spec": {
    "proposal_id": "prop-tighten-guard",
    "target_ref": "policies/maint/default.json",
    "changes": [
      {
        "path": "/spec/rules/0/then/allow",
        "op": "replace",
        "value": false
      }
    ],
    "applied_at": "2026-02-15T11:00:00Z",
    "hash": "sha256:1234"
  }
}
