{
  "apiVersion": "tracemind.io/v0.1",
  "kind": "Proposal",
  "metadata": {
    "id": "prop-missing-impacted",
    "version": "1.0.0"
  },
  "spec": {
    "impacted_intents": [],
    "patch_refs": ["patch_ok.json"],
    "testsuite_refs": ["testsuite_hard_pass.json"],
    "risk": "medium",
    "summary": "missing impacted"
  }
}
